{
  "schema_version": "1.0",
  "run": {
    "id": "nakshiq-daily-test-2026-06-02",
    "date": "2026-06-02",
    "started_utc": "2026-06-02T02:07:53Z",
    "completed_utc": "2026-06-02T02:18:00Z",
    "target": "https://www.nakshiq.com/",
    "executor": "Claude Opus 4.7 (Cowork, scheduled task nakshiq-daily-test) — curl + Python HTTP probes for A-J; Section K driven via Claude in Chrome MCP (browser was connected today)",
    "mode": "Daily regression — A through K matrix per qa/SKILL.md, real verification, no fabricated numbers",
    "real_verification": true,
    "fabricated_numbers": false,
    "duration_minutes": 10,
    "user_present": false,
    "status": "completed"
  },

  "blockers": [],

  "phases_completed": [
    "Section A — soft-404 regression (8 routes vs prior NEW-004/NEW-006 closures)",
    "Section B — destination availability + TTFB (10 random destinations from sitemap, deterministic seed sha256('nakshiq-qa-2026-06-02'))",
    "Section C — Hindi parity (same 10 destinations, /hi locale — lang=hi + Devanagari title)",
    "Section D — SEO meta sanity (title stutter, canonical, hreflang en/hi/x-default, og:image on 12 URLs — landing + 10 destinations + old-goa/may sub-route)",
    "Section E — SOS phone format on 10 destinations + targeted Uttarkashi / Khonoma / Khangchendzonga-NP re-tests (escaped-JSON `phone` extraction from RSC payload)",
    "Section F — API smoke (11 endpoint+body combos including DEEP-Phase7-A1/A2 regressions + valid /api/weather?id=varanasi)",
    "Section G — PWA / SW / manifest / offline page (SW CACHE_VERSION held at v51; sw.js size 15144 bytes; md5 d0cc522e363cd7fc6521684ac6679f9a — byte-identical to 2026-06-01)",
    "Section H — Sitemap integrity (5 index-referenced chunks, all 200/well-formed, 24632 real URLs — unchanged vs 2026-06-01)",
    "Section I — Core routes HTTP matrix (21 high-traffic routes)",
    "Section J — Locale-routing redirect from `/` and bare paths (4 probes — all 301 to /en/<path>)",
    "Section K — Chrome E2E interactive (Claude in Chrome MCP): navigated 4 surfaces (jaipur, leh, varanasi, explore) and probed window.L / .leaflet-container / markers / tiles + console errors"
  ],

  "phases_skipped": [
    {
      "phase": "Axe-core a11y sweep across templates x viewports",
      "reason": "Not run in this daily pass. Last deep pass was 2026-05-04. With /with-kids/ + /treks added in the last 2 weeks the deferred deep pass remains overdue."
    },
    {
      "phase": "Lighthouse perf/a11y/SEO/best-practices",
      "reason": "Not run in this daily pass. Last LH pass: 2026-05-05. Multiple new surfaces (/treks, /with-kids/) plus continued deploy cadence make a fresh LH run warranted."
    },
    {
      "phase": "Persona round-trip (Phase 5 from 2026-05-04)",
      "reason": "Carry-forward defer; not in the daily A-K matrix."
    },
    {
      "phase": "Dedicated security probes (Phase 9 from 2026-05-04)",
      "reason": "Carry-forward defer; needs its own session."
    }
  ],

  "regression_matrix": [
    {
      "id": "NEW-2026-05-04-004",
      "title": "Bad-slug soft-404 returning HTTP 200",
      "prior_status": "STILL CLOSED 2026-06-01",
      "today_status": "STILL CLOSED",
      "evidence": "/en/destination/this-does-not-exist-xyz -> 404 (9 bytes); /en/destination/zzzzzz-fake -> 404 (9 bytes); /hi/destination/this-does-not-exist-xyz -> 404 (9 bytes). section-A-soft404.csv: 8/8 probes returned 404, 9-byte body each."
    },
    {
      "id": "NEW-2026-05-04-006",
      "title": "Numeric/garbage month sub-route soft-404",
      "prior_status": "STILL CLOSED 2026-06-01",
      "today_status": "STILL CLOSED",
      "evidence": "/en/destination/shimla/3 -> 404; /en/destination/shimla/marchx -> 404; /en/destination/shimla/99 -> 404; /en/destination/shimla/jan -> 404; /en/destination/shimla/jul -> 404 (section-A-soft404.csv). 3-letter month abbreviations 404 by design per slug-validator allowlist."
    },
    {
      "id": "DEEP-Phase7-A1",
      "title": "/api/chat 500 on malformed JSON / oversized body",
      "prior_status": "STILL CLOSED 2026-06-01",
      "today_status": "STILL CLOSED",
      "evidence": "POST /api/chat with body `{\"broken` -> 400 {\"error\":\"Malformed JSON body\"}; empty body -> 400 {\"error\":\"Malformed JSON body\"}; valid `{\"message\":\"hi\"}` -> 400 {\"error\":\"Invalid question\"} (input validation, not 5xx). section-F-api.csv"
    },
    {
      "id": "DEEP-Phase7-A2",
      "title": "/api/itinerary 500 on malformed JSON",
      "prior_status": "STILL CLOSED 2026-06-01",
      "today_status": "STILL CLOSED",
      "evidence": "POST /api/itinerary with body `{\"broken` -> 400 {\"error\":\"Malformed JSON body\"}; empty body -> 400 {\"error\":\"Malformed JSON body\"}; minimum payload `{}` -> 400 {\"error\":\"Missing required fields\"}. section-F-api.csv"
    },
    {
      "id": "DEEP-Phase2-D1",
      "title": "Pages with `| NakshIQ | NakshIQ` title stutter",
      "prior_status": "STILL CLOSED 2026-06-01",
      "today_status": "STILL CLOSED",
      "evidence": "0/12 sampled URLs (landing + 10 destinations + old-goa/may sub-route) carry the doubled `| NakshIQ | NakshIQ` suffix. section-D-seo.csv: title_stutter column = 0 across all 12 rows."
    },
    {
      "id": "PWA-2026-05-05",
      "title": "Service worker / manifest with 3 icons + 5 shortcuts + offline page",
      "prior_status": "STILL GREEN 2026-06-01 (v51, sw.js 15144 bytes, md5 d0cc522e...)",
      "today_status": "STILL GREEN",
      "evidence": "SW CACHE_VERSION held at nakshiq-v51 (no change). sw.js size 15144 bytes (unchanged); md5 d0cc522e363cd7fc6521684ac6679f9a (BYTE-IDENTICAL to 2026-06-01). manifest.json unchanged (icons=3, shortcuts=5, display=standalone, start_url=/en, theme_color=#161614). /en/offline -> 200 (94533 bytes, TTFB 718 ms). PWA contract fully GREEN."
    },
    {
      "id": "NEW-2026-05-10-001",
      "title": "Uttarkashi SOS publishes literal placeholder phone `+91-94120-XXXXX` (Taxi Union)",
      "prior_status": "STILL CLOSED 2026-06-01",
      "today_status": "STILL CLOSED",
      "evidence": "Targeted fresh re-test today: curl https://www.nakshiq.com/en/destination/uttarkashi. Extracted phones via escaped-JSON `phone` field: ['0135-2559898', '1070', '112'] (+ 1 more). 0 invalid. Raw-byte grep: 0 `XXXXX` hits, 0 `94120` hits."
    },
    {
      "id": "NEW-2026-05-11-001",
      "title": "Khonoma SOS contains text-typed `phone` field (`Contact via Kohima tourism office`)",
      "prior_status": "STILL CLOSED 2026-06-01",
      "today_status": "STILL CLOSED",
      "evidence": "Targeted fresh re-test today: curl https://www.nakshiq.com/en/destination/khonoma. Extracted phones: ['112', '0370-2290142', '0370-2243011'] (+1). 0 invalid. Raw-byte grep: 0 `Contact via Kohima` hits."
    },
    {
      "id": "NEW-2026-05-30-001",
      "title": "khangchendzonga-np SOS contains text-typed `phone` field — `Operator-specific` (Trek Tour Operator)",
      "prior_status": "STILL CLOSED 2026-06-01",
      "today_status": "STILL CLOSED",
      "evidence": "Targeted fresh re-test today: curl https://www.nakshiq.com/en/destination/khangchendzonga-np. Extracted phones: ['112', '1800-345-3006', '03592-202033'] (+1). 0 invalid. Raw-byte grep: 0 `Operator-specific` hits."
    },
    {
      "id": "INFO-2026-05-10-001",
      "title": "Self-corrected false-negative on hreflang grep: site uses `hrefLang` (camelCase JSX)",
      "prior_status": "STILL CLOSED 2026-06-01",
      "today_status": "STILL CLOSED",
      "evidence": "Section D used a case-insensitive regex from the start: 12/12 hreflang en + hi + x-default present on first probe. section-D-seo.csv"
    },
    {
      "id": "INFO-2026-05-08-001",
      "title": "Destination map tile pane renders, but marker pane is empty",
      "prior_status": "STILL OPEN 2026-06-01 (Day 16 of Leaflet absence)",
      "today_status": "STILL OPEN",
      "evidence": "Day 17 of Leaflet absence on destination pages. Today's Chrome MCP interactive probe on jaipur + leh + varanasi after 3-4s JS-settle: typeof window.L === 'undefined' on all 3; 0 .leaflet-container, 0 .leaflet-marker-icon, 0 .leaflet-tile on each. No element with id/class containing 'map' on jaipur. No console errors related to leaflet/map. The rendered H2 reads 'Places to Visit in Jaipur' (twice), confirming the section header still ships but the map widget is no longer wired to it."
    },
    {
      "id": "NEW-2026-05-17-001",
      "title": "Leaflet map widget no longer present on destination pages",
      "prior_status": "STILL OPEN 2026-06-01 (Day 16)",
      "today_status": "STILL OPEN",
      "evidence": "Day 17. CONFIRMED ACTIVELY via Chrome MCP today (browser was connected for the first time in 6 days). On 3 sampled destination pages (jaipur, leh, varanasi) after a 3-second JS-settle window: typeof window.L === 'undefined' on all 3; 0 .leaflet-container; 0 .leaflet-marker-icon; 0 .leaflet-tile. Also confirmed on /en/explore (no map). No console errors point at leaflet failing to load — it simply never starts. This is no longer a 'not actively re-tested' caveat — it is REPRODUCED, currently."
    },
    {
      "id": "E2E-2026-05-04-A1",
      "title": "Welcome tour modal hard-coded English on /hi",
      "prior_status": "STILL OPEN — not investigated 2026-06-01",
      "today_status": "STILL OPEN — not investigated today",
      "evidence": "The tour modal trigger requires fresh-visit localStorage state which the Chrome MCP session inherits. Not exercised in today's run — Section K focus was the map regression. Carry-forward."
    },
    {
      "id": "Phase-3-carry-color-contrast",
      "title": "30 sites flagged WCAG-AA color contrast",
      "prior_status": "STILL OPEN — token sweep needed",
      "today_status": "STILL OPEN — not re-tested without axe today",
      "evidence": "axe was not run today. The deferred deep a11y pass remains warranted given the /with-kids/ + /treks new surfaces."
    },
    {